<?xml version="1.0" encoding="UTF-8"?>
<!DOCTYPE Interprete SYSTEM "iml.dtd">
<Interprete>
        <!--<Nombre>
                <NombreC>Vivaldi</NombreC>
                <Id>0000000010</Id>
        </Nombre>-->
        <Nacionalidad>Española</Nacionalidad>
        <Album tipo="recopilatorio" temas="1">
                <NombreA>Sinfonias vivaldi</NombreA>
                <Año>1000</Año>
                <Cancion estilo="jefe">
                        <NombreT>la crema</NombreT>
                        <Duracion>02:10</Duracion>
		</Cancion>
	</Album>
	<Album tipo="mixto" temas="1">
                <NombreA>Sinfonia 2</NombreA>
                <Año>1001</Año>
                <Cancion estilo="sin estilo">
                        <NombreT>tema 1</NombreT>
                        <Duracion>03:00</Duracion>
                </Cancion>
	</Album>	 
</Interprete>

